{
  "id": "leadership-ownership-core",
  "title": "Leadership and Ownership Core",
  "topic": "leadership",
  "description": "Behavioral flashcards focused on technical leadership, ownership, and influence.",
  "difficulty": "medium",
  "estimatedMinutes": 8,
  "tags": ["leadership", "ownership", "behavioral"],
  "cards": [
    {
      "id": "leadership-without-authority",
      "type": "behavioral",
      "difficulty": "medium",
      "question": "How do you lead without formal authority?",
      "shortAnswer": "By creating clarity, making tradeoffs visible, unblocking execution, and following through consistently.",
      "expectedAnswer": "I lead without formal authority by creating clarity, reducing ambiguity, and helping the team move with confidence. That usually means turning unclear problems into a plan, making tradeoffs explicit, unblocking execution, and raising standards without creating unnecessary friction. Leadership is often more about follow-through and judgment than title.",
      "keyPoints": [
        "clarity and ambiguity reduction",
        "tradeoff visibility",
        "unblocking execution",
        "leadership is not just title"
      ],
      "commonTraps": [
        "sounding managerial without examples",
        "talking only about technical correctness"
      ],
      "followUps": [
        "Tell me about a time you influenced a team decision.",
        "How do you handle disagreement while leading?"
      ],
      "tags": ["leadership", "ownership", "influence"]
    },
    {
      "id": "leadership-project-behind",
      "type": "behavioral",
      "difficulty": "medium",
      "question": "What do you do when a project is behind schedule?",
      "shortAnswer": "Reassess what is critical, surface risks early, cut scope before quality, and realign stakeholders around the new plan.",
      "expectedAnswer": "When a project is behind, I first identify what is truly critical and what can move. I surface risks early, cut scope before cutting quality, and realign stakeholders around a realistic plan. The goal is to protect trust and delivery quality instead of hiding the problem until it becomes harder to recover from.",
      "keyPoints": [
        "identify what is critical",
        "surface risks early",
        "cut scope before quality",
        "realign stakeholders"
      ],
      "commonTraps": [
        "answering with overtime as the default fix",
        "ignoring stakeholder communication"
      ],
      "followUps": [
        "How do you decide what to cut?",
        "How do you communicate bad news early?"
      ],
      "tags": ["leadership", "delivery", "stakeholders"]
    }
  ]
}
