{
  "id": "javascript-runtime-core",
  "title": "JavaScript Runtime Core",
  "topic": "javascript",
  "description": "Execution-model and language-behavior questions that come up often in interviews.",
  "difficulty": "medium",
  "estimatedMinutes": 8,
  "tags": ["javascript", "runtime", "event-loop"],
  "cards": [
    {
      "id": "javascript-microtask-vs-macrotask",
      "type": "concept",
      "difficulty": "medium",
      "question": "What is the difference between microtasks and macrotasks in JavaScript?",
      "shortAnswer": "Microtasks run before the next macrotask; Promise callbacks are microtasks and setTimeout callbacks are macrotasks.",
      "expectedAnswer": "Microtasks are processed after the current call stack finishes and before the runtime moves to the next macrotask. Promise callbacks go into the microtask queue, while setTimeout callbacks go into the macrotask queue. That is why Promise handlers usually run before a zero-delay timeout.",
      "keyPoints": [
        "microtasks run before the next macrotask",
        "Promises are microtasks",
        "setTimeout is a macrotask"
      ],
      "learnMore": "A useful mental model is: finish the current stack, drain microtasks, then move to the next macrotask. That explains why Promise handlers often run sooner than people expect.\n\nIn interviews, it helps to connect this to responsiveness. Too many microtasks can still starve other work, so understanding the queue order matters for both correctness and performance.",
      "learnMoreSlug": "javascript-event-loop-without-hand-waving",
      "exampleCode": "console.log('start')\n\nsetTimeout(() => {\n  console.log('timeout')\n}, 0)\n\nPromise.resolve().then(() => {\n  console.log('promise')\n})\n\nconsole.log('end')\n\n// start\n// end\n// promise\n// timeout",
      "exampleLanguage": "ts",
      "commonTraps": [
        "saying setTimeout runs immediately with zero delay",
        "mixing up call stack and queue ordering"
      ],
      "followUps": [
        "How does this affect UI responsiveness?",
        "Where would queueMicrotask fit here?"
      ],
      "tags": ["javascript", "event-loop", "async"]
    },
    {
      "id": "javascript-pass-by-value-reference",
      "type": "concept",
      "difficulty": "medium",
      "question": "Is JavaScript pass-by-reference?",
      "shortAnswer": "No. JavaScript is pass-by-value, and object references are themselves values.",
      "expectedAnswer": "JavaScript is pass-by-value. For objects, the value being copied is the reference, not the object itself. That is why mutating an object through one variable is visible through another variable that points to the same object, but reassigning one variable does not change the other.",
      "keyPoints": [
        "JavaScript is pass-by-value",
        "object references are values",
        "mutation differs from reassignment"
      ],
      "learnMore": "This is one of those interview questions that sounds trickier than it is. The clean answer is: JavaScript always passes values. For objects, that value happens to be a reference-like pointer.\n\nThat is why changing object contents is visible through other variables that point to the same object, while reassigning the parameter only changes the local variable binding.",
      "exampleCode": "function rename(user) {\n  user.name = 'Andrews'\n}\n\nfunction replaceUser(user) {\n  user = { name: 'New user' }\n}\n\nconst original = { name: 'Old name' }\n\nrename(original)\nconsole.log(original.name) // Andrews\n\nreplaceUser(original)\nconsole.log(original.name) // Andrews",
      "exampleLanguage": "ts",
      "commonTraps": [
        "saying everything is pass-by-reference",
        "confusing shared object mutation with parameter passing semantics"
      ],
      "followUps": [
        "How would you explain shallow copy vs deep copy after that?",
        "Why does spread not solve every cloning case?"
      ],
      "tags": ["javascript", "references", "language-semantics"]
    }
  ]
}
